@DM0,,Tray Pos_Positioning Step,,
@DM1,,Fine Weigh Pos_Positioning Step,,
@DM2,,Tray Pick Pos_Positioning Step,,
@DM3,,Camera Pos_Positioning Step,,
@DM4,,XRF Pos_Positioning Step,,
@DM5,,Lid Place Pos_Positioning Step,,
@DM6,,Lid Open Pos_Positioning Step,,
@DM7,,Graphite Pos_Positioning Step,,
@DM8,,Smelting Pos_Positioning Step,,
@DM9,,K-Gold Pos_Positioning Step,,
@DM10,,Pure Gold Pos_Positioning Step,,
@DM14,,HMI Pos Button Input Timer,,
@MR000,,Z Axis Homing Start,,
@MR001,,Z Axis Homing_Pre-Axis Pos,,
@MR004,,Axis 1-3 Running,,
@MR005,,Stop_Axis Pos,,
@MR006,,X Axis Homing Timeout,,
@MR007,,Y Axis Homing Timeout,,
@MR008,,Z Axis Homing Timeout,,
@MR010,,HMI Pos Flag,,
@MR011,,Homing_Init Flag,,
@MR015,,Point-to-Point Pos Flag,,
@MR100,,HMI Move to Carrier Station,,
@MR101,,HMI Move to Fine Scale Station,,
@MR102,,HMI Move To Tray Pick Pos,,
@MR103,,HMI Move to Vision Station,,
@MR104,,HMI Move to XRF Analyzer,,
@MR105,,HMI Move to Lid Place Station,,
@MR106,,HMI Move to Lid Open Station,,
@MR107,,HMI Move to Graphite Station,,
@MR108,,HMI Move to Melting Station,,
@MR109,,HMI Move to K-Gold Station,,
@MR110,,HMI Move to Pure Gold Station,,
@MR200,,Tray Pos_Pos Start,,
@MR201,,Fine Weigh Pos_Pos Start,,
@MR202,,Tray Pick Pos_Pos Start,,
@MR203,,Camera Pos_Pos Start,,
@MR204,,XRF Pos_Pos Start,,
@MR205,,Lid Place Pos_Pos Start,,
@MR206,,Lid Open Pos_Pos Start,,
@MR207,,Graphite Pos_Pos Start,,
@MR208,,Smelting Pos_Pos Start,,
@MR209,,K-gold Posn Start,,
@MR210,,Pure Gold Posn Start,,
@MR211,,K-gold Run,,
@MR212,,Pure Gold Run,,
@MR300,,Tray Posn Stop,,
@MR301,,Fine Scale Posn Stop,,
@MR302,,Tray Pick Posn Stop,,
@MR303,,Camera Posn Stop,,
@MR304,,XRF Posn Stop,,
@MR305,,Lid Posn Stop,,
@MR306,,Open Lid Posn Stop,,
@MR307,,Graphite Posn Stop,,
@MR308,,Melting Posn Stop,,
@MR309,,K-gold Posn Stop,,
@MR310,,Pure Gold Posn Stop,,
@MR400,,Tray X-Axis Positioning,,
@MR401,,Fine Scale X-Axis Positioning,,
@MR402,,Tray Pick X-Axis Positioning,,
@MR403,,Camera X-Axis Positioning,,
@MR404,,XRF X-Axis Positioning,,
@MR405,,Lid X-Axis Positioning,,
@MR406,,Open Lid X-Axis Positioning,,
@MR407,,Graphite X-Axis Positioning,,
@MR408,,Melting X-Axis Positioning,,
@MR409,,K-Gold X-Axis Positioning,,
@MR410,,Pure Gold X-Axis Positioning,,
@MR500,,Tray Y-Axis Positioning,,
@MR501,,Fine Scale Y-Axis Positioning,,
@MR502,,Tray Pick Y-Axis Positioning,,
@MR503,,Camera Y-Axis Positioning,,
@MR504,,XRF Y-Axis Positioning,,
@MR505,,Lid Y-Axis Positioning,,
@MR506,,Open Lid Y-Axis Positioning,,
@MR507,,Graphite Y-Axis Positioning,,
@MR508,,Melting Y-Axis Positioning,,
@MR509,,K-Gold Y-Axis Positioning,,
@MR510,,Pure Gold Y-Axis Positioning,,
@MR600,,Tray Z-Axis Positioning,,
@MR601,,Fine Scale Z-Axis Positioning,,
@MR602,,Tray Pick Z-Axis Positioning,,
@MR603,,Camera Z-Axis Positioning,,
@MR604,,XRF Z-Axis Positioning,,
@MR605,,Lid Z-Axis Positioning,,
@MR606,,Open Lid Z-Axis Positioning,,
@MR607,,Graphite Z-Axis Positioning,,
@MR608,,Melting Z-Axis Positioning,,
@MR609,,K-Gold Z-Axis Positioning,,
@MR610,,Pure Gold Z-Axis Positioning,,
@MR700,,Tray X-Axis Posn Done,,
@MR701,,Fine Scale X-Axis Posn Done,,
@MR702,,Tray Pick X-Axis Posn Done,,
@MR703,,Camera X-Axis Posn Done,,
@MR704,,XRF X-Axis Posn Done,,
@MR705,,Lid X-Axis Posn Done,,
@MR706,,Open Lid X-Axis Posn Done,,
@MR707,,Graphite X-Axis Posn Done,,
@MR708,,Melting X-Axis Posn Done,,
@MR709,,K-gold X-Axis Posn Done,,
@MR710,,Pure Gold X-Axis Posn Done,,
@MR800,,Tray Y-Axis Posn Done,,
@MR801,,Fine Scale Y-Axis Posn Done,,
@MR802,,Tray Pick Y-Axis Posn Done,,
@MR803,,Camera Y-Axis Posn Done,,
@MR804,,XRF Y-Axis Posn Done,,
@MR805,,Lid Y-Axis Posn Done,,
@MR806,,Open Lid Y-Axis Posn Done,,
@MR807,,Graphite Y-Axis Posn Done,,
@MR808,,Melting Y-Axis Posn Done,,
@MR809,,K-gold Y-Axis Posn Done,,
@MR810,,Pure Gold Y-Axis Posn Done,,
@MR900,,Tray Z-Axis Posn Done,,
@MR901,,Fine Scale Z-Axis Posn Done,,
@MR902,,Tray Pick Z-Axis Posn Done,,
@MR903,,Camera Z-Axis Posn Done,,
@MR904,,XRF Z-Axis Posn Done,,
@MR905,,Lid Z-Axis Posn Done,,
@MR906,,Open Lid Z-Axis Posn Done,,
@MR907,,Graphite Z-Axis Posn Done,,
@MR908,,Melting Z-Axis Posn Done,,
@MR909,,K-gold Z-Axis Posn Done,,
@MR910,,Pure Gold Z-Axis Posn Done,,
@MR1000,,Z-Axis Homing Flag,,
@MR1001,,Init Move to Carrier Station,,
@MR1002,,Tray Pos Init Start,,
